{
  "schema_version": 1,
  "suite_id": "botmux-parity-v1",
  "default_action": "self_check_only",
  "safety_contract": {
    "starts_or_stops_listener": false,
    "writes_botmux_source": false,
    "writes_dutydeck_database": false,
    "uses_existing_credentials": false,
    "writes_only_disposable_test_state": true,
    "isolates_home_tmp_ports_tmux": true,
    "checks_tmux_residue": true,
    "real_lark_requires_dedicated_test_app": true,
    "real_lark_requires_external_fencing": true
  },
  "required_coverage": [
    "remote_open_http",
    "remote_open_sse",
    "remote_open_terminal_ws",
    "same_origin",
    "secret_provider",
    "importer_read_only",
    "importer_cli",
    "daemon_restart_reattach",
    "active_turn_result_reconstruction",
    "channel_routing",
    "effective_config",
    "rbac",
    "high_risk_gates",
    "staged_fail_closed",
    "schedule_single_writer",
    "schedule_dst",
    "schedule_idempotency",
    "schedule_lease",
    "schedule_offline_api",
    "schedule_activation",
    "identity_preflight",
    "listener_lease",
    "dual_consumer_fencing",
    "rollback",
    "real_lark_opt_in"
  ],
  "cases": [
    {
      "id": "remote-open-contract-http-sse",
      "title": "Explicit remote-open mode serves HTTP/SSE without a token and rejects cross-origin browsers",
      "coverage": ["remote_open_http", "remote_open_sse", "same_origin"],
      "execution": "offline",
      "expectation": "pass",
      "command": [
        "node", "node_modules/vitest/vitest.mjs", "run",
        "apps/server/src/access-mode.test.ts",
        "apps/server/src/auth/auth.test.ts",
        "--project", "node"
      ],
      "evidence_sources": [
        "dutydeck:apps/server/src/access-mode.test.ts",
        "dutydeck:apps/server/src/auth/auth.test.ts"
      ],
      "assertions": [
        "explicit open mode never reads or requires an access token",
        "HTTP and SSE are reachable without Authorization or Cookie",
        "cross-origin browser requests fail before subscribing or mutating",
        "trusted proxy origin is compared against the effective public origin"
      ]
    },
    {
      "id": "remote-open-contract-terminal-ws",
      "title": "Explicit remote-open Terminal WebSocket is tokenless but exact same-origin",
      "coverage": ["remote_open_terminal_ws", "same_origin", "high_risk_gates"],
      "execution": "offline",
      "expectation": "pass",
      "command": [
        "node", "node_modules/vitest/vitest.mjs", "run",
        "apps/server/src/terminal/terminal-ws.test.ts",
        "--project", "node"
      ],
      "evidence_sources": [
        "dutydeck:apps/server/src/terminal/terminal-ws.test.ts"
      ],
      "assertions": [
        "open mode accepts an exact same-origin WebSocket without a token",
        "cross-origin upgrades are rejected",
        "query-string tokens are not credentials",
        "token-protected remote mode still rejects a tokenless loopback hop"
      ]
    },
    {
      "id": "remote-dev-open-mode-no-token",
      "title": "Opt-in read-only probe of a remote development Dutydeck HTTP/SSE/Terminal WS endpoint",
      "coverage": ["remote_open_http", "remote_open_sse", "remote_open_terminal_ws", "same_origin"],
      "execution": "remote_opt_in",
      "expectation": "pass",
      "command": ["node", "tests/e2e/integration-contracts/checks/remote-open.mjs"],
      "required_env": ["DUTYDECK_PARITY_BASE_URL", "DUTYDECK_PARITY_SESSION_ID", "DUTYDECK_PARITY_REMOTE_OPEN_ACK"],
      "safety": [
        "runner requires --allow-remote-open",
        "probe sends no Authorization, Cookie, terminal input, or mutation request",
        "base URL may not contain userinfo, query, or fragment",
        "the supplied session must be a dedicated disposable PTY-CLI session"
      ],
      "assertions": [
        "auth status reports required=false",
        "session HTTP is reachable without a token",
        "SSE connects with the exact public Origin and cross-Origin fails",
        "Terminal WS connects with the exact public Origin and cross-Origin fails"
      ]
    },
    {
      "id": "secret-provider-and-cli-boundary",
      "title": "SecretProvider and secret CLI preserve metadata-only, private-file and fail-closed boundaries",
      "coverage": ["secret_provider", "staged_fail_closed"],
      "execution": "offline",
      "expectation": "pass",
      "command": [
        "node", "node_modules/vitest/vitest.mjs", "run",
        "packages/secret-provider/src/index.test.ts",
        "apps/server/src/secret-cli.blackbox.test.ts",
        "apps/server/src/foundation-routes.test.ts",
        "--project", "node"
      ],
      "evidence_sources": [
        "dutydeck:packages/secret-provider/src/index.test.ts",
        "dutydeck:apps/server/src/secret-cli.blackbox.test.ts",
        "dutydeck:apps/server/src/foundation-routes.test.ts"
      ],
      "assertions": [
        "Secret values enter through an FD/runtime-only callback, are never accepted on argv or persisted in metadata, and input buffers are wiped",
        "provider directories and files are private, exclusive and symlink-safe",
        "rotation/removal use CAS and referenced SecretRefs cannot be removed",
        "missing or unreadable SecretRefs keep ChannelBots staged and activation-ineligible"
      ]
    },
    {
      "id": "importer-redaction-no-go-source-immutable",
      "title": "Importer core emits a redacted NO_GO plan and never mutates its synthetic Botmux source",
      "coverage": ["importer_read_only"],
      "execution": "offline",
      "expectation": "pass",
      "command": ["node", "node_modules/tsx/dist/cli.mjs", "tests/e2e/integration-contracts/checks/importer-read-only.mts"],
      "fixtures": ["fixtures/importer"],
      "evidence_sources": [
        "dutydeck:packages/legacy-importer/src/importer.ts",
        "dutydeck:packages/legacy-importer/src/archive.ts"
      ],
      "assertions": [
        "production_cutover is NO_GO and activation_ready is false",
        "Hammer, enabled Schedule, active topic, and unknown configuration are blockers",
        "plans and manifests contain no raw App, chat, principal, path, prompt, or secret",
        "source tree digest is unchanged after plan and encrypted archive"
      ]
    },
    {
      "id": "importer-cli-discover-plan-archive",
      "title": "Importer CLI discover, plan and archive remain redacted, exclusive and non-activating",
      "coverage": ["importer_read_only", "importer_cli", "staged_fail_closed"],
      "execution": "offline",
      "expectation": "pass",
      "command": [
        "node", "node_modules/vitest/vitest.mjs", "run",
        "apps/server/src/legacy-import-cli.blackbox.test.ts",
        "--project", "node"
      ],
      "evidence_sources": [
        "dutydeck:apps/server/src/legacy-import-cli.blackbox.test.ts",
        "dutydeck:apps/server/src/legacy-import-cli.ts"
      ],
      "assertions": [
        "the CLI exposes discover, plan and archive but no apply/stage/activate/cutover/resume command",
        "discover and plan stay NO_GO, redact paths/identities/secrets and leave the source digest unchanged",
        "redacted outputs use exclusive 0600 files and refuse overwrite or symlink targets",
        "archive requires an explicit non-argv passphrase FD, writes 0700/0600 encrypted output and never changes the source"
      ]
    },
    {
      "id": "daemon-restart-owned-run-reattach",
      "title": "A completed Dutydeck-owned run reattaches on the same pane PID after service restart and final stop destroys it",
      "coverage": ["daemon_restart_reattach"],
      "execution": "offline",
      "expectation": "pass",
      "command": ["node", "tests/e2e/integration-contracts/checks/wp2-service-restart.mjs"],
      "fixtures": ["fixtures/restart-run.json"],
      "evidence_sources": [
        "dutydeck:apps/server/src/service.test.ts",
        "dutydeck:apps/server/src/service.ts"
      ],
      "assertions": [
        "two service lifetimes use the same isolated SQLite database",
        "the second service lazily reconnects the persisted session without an eager duplicate driver",
        "the tmux pane PID is unchanged after the post-restart turn",
        "both completed prompts remain persisted",
        "explicit final session stop destroys the tmux session",
        "the wrapper leaves no tmux session in its isolated TMUX_TMPDIR namespace"
      ]
    },
    {
      "id": "active-turn-result-reconstruction-after-restart",
      "title": "An active turn survives daemon loss and reconstructs its exact final result after reconnect",
      "coverage": ["active_turn_result_reconstruction"],
      "execution": "expected_blocked",
      "expectation": "expected_blocked",
      "reason_code": "ACTIVE_TURN_RESULT_RECONSTRUCTION_NOT_PROVEN",
      "blocked_by": [
        "the WP2 service test restarts only between completed turns",
        "runtime initialization currently classifies tasks left running by the prior process as interrupted",
        "no service-level test reconstructs the terminal result, task completion, and delivery identity for a turn active during restart"
      ],
      "fixtures": ["fixtures/restart-run.json"],
      "supporting_evidence": [
        "dutydeck:apps/server/src/service.test.ts",
        "dutydeck:packages/agent-runtime/src/runtime.test.ts"
      ]
    },
    {
      "id": "agent-channelbot-groupbinding-routing",
      "title": "Agent, ChannelBot and GroupBinding resolve App+Chat routing, mention/topic and group-tool ceilings offline",
      "coverage": ["channel_routing", "effective_config"],
      "execution": "offline",
      "expectation": "pass",
      "command": [
        "node", "node_modules/vitest/vitest.mjs", "run",
        "packages/shared/src/group-policy.test.ts",
        "packages/storage/src/group-policy.test.ts",
        "apps/server/src/foundation-routes.test.ts",
        "--project", "node"
      ],